{
  "schema": "ucc.health-observation",
  "schema_version": 1,
  "id": "rpt_01K0A6R4V8W6E3M4M8Y0R9J2QZ",
  "created_at": "2026-08-22T12:00:00.000Z",
  "created_by": "act_01K0A6R4V8W6E3M4M8Y0R9J2QA",
  "record_version": 1,
  "node_id": "node_01K0A6R4V8W6E3M4M8Y0R9J2QX",
  "observed_at": "2026-08-22T12:00:00.000Z",
  "health": "healthy",
  "runtime_state": "running",
  "freshness_seconds": 5.0,
  "details": {
    "cpu_pct": 12.5,
    "mem_pct": 45.0
  }
}
